post_id,context,created_at,updated_at,user_id
?,在城市的小巷裡偶然發現了一間酒吧，氛圍既神秘又迷人。🌃🍷 #城市探險 #隱藏酒吧 #酒吧,?,?,23
?,昨晚觀看了一場震撼人心的科幻大片，令人回味無窮。🌌🎬 #科幻愛好者 #電影之夜 #電影,?,?,63
?,和摯愛在星光下享受了一次難忘的露天電影之夜，浪漫無比。✨📽️ #浪漫約會 #露天電影 #電影,?,?,45
?,在一間風格獨特的酒吧中，與老友重逢，共度了一個難忘的夜晚。🍻🎤 #友誼 #酒吧聚會 #酒吧,?,?,53
?,周末在家進行了一次電影馬拉松，從黎明到黃昏，享受著屬於自己的小世界。🏠🎞️ #宅在家 #電影馬拉松 #電影,?,?,77
?,獨自一人在一間雅致的酒吧中靜享時光，沉醉於書本和美酒之中。📚🍸 #獨自享受 #閱讀 #酒吧,?,?,91
?,在海邊的一間酒吧裡，聽著浪濤聲，看著日落，度過了一段靜謐時光。🌊🌇 #海邊日落 #寧靜時刻 #酒吧,?,?,145
?,我發現了一個超酷的露天酒吧，可以邊喝酒邊看星星，太美妙了！🌠🍹 #露天酒吧 #夜晚觀星,?,?,523
?,我在那家熱門酒吧終於嘗試了他們的招牌雞尾酒，味道絕了！🍸👍 #雞尾酒探索 #酒吧,?,?,324
?,昨晚和朋友們在家裡舉行了一場電影馬拉松，從傍晚看到凌晨，疲憊但快樂！📽️🍕 #電影馬拉松 #朋友聚會,?,?,123
?,今晚的約會計劃是去那個大家都說好的意大利餐廳，然後去看電影。🍝🎥 #約會晚餐 #電影之夜,?,?,264
?,最近在一家小酒吧發現了一支超棒的現場樂隊，每個週末都想去聽他們演奏！🎸🍺 #現場音樂 #酒吧,?,?,102
?,昨天試了一家酒吧的特色小吃，真的是意想不到的美味，推薦給大家！🍟🍹 #酒吧美食 #美味推薦,?,?,321
?,這次的家庭電影之夜選了一部動畫電影，大人小孩都喜歡，家庭和樂融融。👨‍👩‍👧‍👦🎬 #家庭電影之夜 #動畫電影,?,?,376
?,又一次在我最愛的酒吧結束了一天的工作，這裡就是我的放鬆天堂。🍺🌆 #下班放鬆 #愛的酒吧,?,?,564
?,最近瘋狂迷上了一個新出的科幻電影系列，劇情太吸引人了，停不下來！🌌🎬 #科幻電影 #追劇狂,?,?,758
?,這個月底計劃和朋友去參加一個著名導演的電影回顧展，期待已久！🎬🍿 #電影回顧展 #導演作品,?,?,842
?,上週末的約會我們選擇了戶外野餐然後租了一輛雙人自行車，真是太棒了！🧺🚴‍♂️ #約會 #戶外活動,?,?,423
?,在一家老式酒吧度過了一個懷舊之夜，從裝潢到音樂都讓人感覺時光倒流。🎶🍷 #懷舊酒吧 #時光倒流 #酒吧,?,?,643
?,終於看了那部大家狂熱推薦的恐怖電影，整晚都睡不著了！😱🎥 #恐怖電影 #驚悚之夜 #電影,?,?,828



通過一部深具啟發性的紀錄片，重新審視了生活的意義和價值。🌍📽️ #啟發思考 #紀錄片 #電影
在一家主題酒吧的復古之夜中，與朋友們穿越時空，感受那不同年代的韻味。🕰️🍹 #復古主題 #穿越時空 #酒吧
進入了一個由電影場景搭建的逃脫室，體驗了一次電影般的冒險。🔍🎥 #逃脫室 #電影體驗 #電影
通過一部感人至深的浪漫電影，重新點燃了對愛情的信仰和期待。💖📺 #浪漫電影 #愛情故事 #電影
在一間精品酒吧舉辦的詩歌朗誦夜，與陌生人分享了內心的故事和情感。📖🍷 #詩與酒 #朗誦之夜 #酒吧
在一次隨性的約會中，我們漫步於城市的燈火中，享受著彼此的陪伴。🚶‍♂️💑 #城市漫步 #隨性約會 #約會
在一個安靜的夜晚，獨自或與愛人一起在家觀看老電影，感受經典的魅力。🏡📀 #家庭電影夜 #經典電影 #電影
在一家新開的酒吧發現了一款口味獨特的自製雞尾酒，令人驚喜。🍹🆕 #新開酒吧 #雞尾酒發現 #酒吧
透過一次主題明確的電影之夜，深入探討了某一社會議題，引發了深思。🎥🤔 #主題電影夜 #深思 #電影
在一家古典音樂主題的酒吧中，享受著音樂與美酒的完美結合。🎻🍷 #古典音樂 #音樂之夜 #酒吧
在朋友家的院子裡，舉辦了一場小型的戶外電影之夜，享受著親密無間的歡樂時光。🎬🌳 #戶外電影 #朋友聚會 #電影
通過觀看一部描繪旅行冒險的電影，激發了探索未知的渴望和勇氣。🌍🎞️ #旅行電影 #冒險精神 #電影
在一次意外的約會中，發現了一家充滿藝術氣息的酒吧，讓晚上變得更加特別。🎨🍸 #藝術酒吧 #意外發現 #約會